{
  "case_id": "figures4papers_figure_Cflows_diffusion_swiss_roll_png",
  "mode": "medium",
  "keep_status": "live",
  "visual_family": "3d_manifold",
  "uniqueness": "unknown",
  "manual_override": true,
  "reason": "manual UI group assignment",
  "reviewed_at": "2026-05-18T15:48:08.008795+00:00"
}
